{"company_info": {"Email": "sales.hr.osg@gmail.com", "Company Name": "[Company Hidden]", "Telephone": "7428208815"}, "api_data": {"job_location": ["Delhi"], "jd_id": "8249759", "job_keywords": ["ticketing", " communication", " iata", " sales", " air", " amadeus", " galileo", "skills", " reservations", " tour", " airline", " operator", " reservation"], "job_industry": "Travel / Tourism", "company_name": "[Company Hidden]", "job_experience": "0 to 3 Yrs", "job_title": "Urgently require 3 Female Air Ticketing Executives at Rajouri Garden, Delhi"}, "other_details": {"Other Skills:": ["skills", "reservations", "tour", "airline", "operator", "reservation"], "Department:": ["Reservation / Ticketing"], "Industry:": ["Travel / Tourism"], "Skills:": ["ticketing", "communication", "iata", "sales", "air", "amadeus", "galileo"]}, "topbox_information": {"salary_information": ""}, "jd_information": {"description": "Dear candidates we have urgently require 3 Female Air Ticketing Executives at Rajouri Garden, Delhi.Note : Candidate must have good communication skills and knowledge of one of these (AMADEUS, GALILEO or IATA.Candidate must have minimum year experience.&nbsp;Location :&nbsp;Rajouri Garden, New Delhi.Company :&nbsp;Company is online tour operator company with offer Best cheapest Holidays packages in South Africa, Hong Kong, spain, Dubai, Greece, Thailand tour.Salary : Up to 22K&nbsp;If you or any of your friend is interested please mail me your resume or contact me as soon as possible.Thanks and regardsHarish Kumar (HR)7428208815sales.hr.osg@gmail.com"}, "_id": "8249759"}